UUID,Area of Expertise,Programming,Past Experience,Course Prefs
9c734ca6-ba36-45ac-9729-30f9dc6d2eb7,"In Computer Science, my area of expertise lies in deep learning, a field that has always captivated me with its potential to revolutionize various applications. My academic journey has been enriched with extensive research, leading to two publications at IEEE conferences and one pending submission.  I have two years of professional experience as a mobile app developer, which has played a pivotal role in shaping my skills in systems and architecture. Through designing and building mobile applications, I have gained valuable insights into the intricacies of software design, optimization, and scalability. This practical experience complements my academic knowledge and equips me to offer a holistic perspective on the subject matter.","I have extensive experience with Java, C, C++, and SQL, having utilized these languages for academic settings and personal projects, gaining proficiency in systems-level programming and object-oriented design. In addition to my academic experience, I have applied Java extensively in my day-to-day work as an Android developer. I am proficient in Linux, Windows, and macOS. I predominantly use Linux for personal projects and have utilized macOS for my professional work.",,CourseTakenGradeCS 238PYCS 271PY
4a52f4a6-4097-464d-ab23-f95d0e3649c0,I consider data analytics and visualization to be my area of expertise. I have also had a lot of experience in data science.,I have some experience with Java and the macOS operating system. Most of my programming was done using MATLAB and R/RStudio. I also have experience in Markdown and TeX.,,CourseTakenGradeSTAT 6NSTAT 7NSTAT 67N
dc078ee7-ea4d-4798-a3fd-8bb922dab206,(Part of the Computational Science program) Math Physics Fortran Python MATLAB Writing Discrete Math,"Some experience with C, C++, SQL, and bash. Very proficient with Python. Very proficient with Windows and comfortable with macOS and Linux.",CourseTitleInstructorPositionWhenICS 6BBoolean Logic and Discrete StructurWayne HayesTA2019-summerICS 6BBoolean LogicIrene GasskoTA2019-fallICS 31Introduction to ProgrammingShannon AlfaroTA2023-winterICS 139WCritical WritingShannon AlfaroTA2022-spring,CourseTakenGradeICS 6BNICS 139WNICS 33NISC 32N
c3c96ea4-98e1-4ef2-bc63-ec8abe3c416b,"I am a fourth year PhD student in CS. I have completed eleven theory courses: CS 232: Computer and Communication Networks (A+), CS 250B: Modern Computer System (A+), CS 241: Advanced Compiler Construction(A+), CS 244: Introduction to Embedded and Ubiquitous Systems (A+), CS 203: Network & Distributed System Security (A+), CS 205: Computer & System Security (A+), CS 201: Cryptography Protocols (A), CS 233: Networking Lab (A-), CS 273A: Machine Learning (A-), EECS 215: Design and Analysis of Algorithms (A-), CS 222: Principles of Data Management (B+)  I have worked as a TA for CS 201P: Computer Security. Additionally, I have worked as a reader for CS 134: Computer and Network Security, CS 132: Computer Networks, CS 103: Advanced Programming and Problem Solving in C++, CS 133: Advanced Computer Networks. I have taken discussion sessions in person, held office hour through Zoom, communicated with students through Piazza and graded assignments through Gradescope.  I have almost three years' professional experience in software development. I have written backend REST APIs, developed web features, implemented authentication and authorization mechanisms, developed and implemented SQL databases, used cryptography libraries, done documentation.  I consider myself proficient in Computer Networks. I got A+ in CS 232: Computer and Communication Networks. I have taken CS 233: Networking Lab too and got an A-. So I have both theoretical and practical experiences. I also worked as a reader for CS 132: Computer Networks and CS 133: Advanced Computer Networks.   I am skilled in Operating System too. I took CS 250B: Modern Computer System in the Spring Quarter and got A+. I also obtained the highest grade in my undergraduate Operating System course.  My research interest is in Security. I have taken three graduate-level security courses and obtained A+/A in all of them. Additionally, I have experience working as a TA for CS 201P: Computer Security. I also took a graduate-level course in Network Security in my previous institute and my term paper on Session Hijacking got accepted at WTS 2020 conference. Besides, I have worked on the security team of our company. So I have in-depth theoretical and practical knowledge in this subject.  I have taken undergraduate level courses and achieved the highest grade in digital logic design, object-oriented programming, computer architecture. I have also taken undergraduate level courses and performed well in data structures and structured programming.","I have more than five years' academic experience and around three years' professional experience with Java, C and C++. I do not have any experience with VHDL, Scheme and Unix. Regarding Unix, however, I have adequate experience with Ubuntu.   I have been using Windows in both personal and professional life for more than ten years. So I am sufficiently adept in Windows Operating System.",CourseTitleInstructorPositionWhenCS 161Design & Analysis of AlgorithmsIoannis PanageasTA2023-springCS 132Computer NetworksMarco LevoratoReader2021-winterCS 201PComputer SecurityMichael T. GoodrichTA2021-fallCS 133Advanced Computer NetworksMagda El ZarkiReader2021-summer,CourseTakenGradeCS 132NCS 134NCS 142ANCS 143AN
d6c39c2b-b0a4-452d-bae4-3296af613993,"Areas of Computer science which I have expertise are Data Structure, Algorithms and System Design and Critical Writing on Information Technology. I have qualified the Graduate Aptitude Test Engineering in Computer Science,one of the highly competitive exams conducted in India for admission into higher studies. I have expertise in Mathematics courseworks pertaining to CS and writing course works based on my previous TA experience.In the spring, 20 quarter I TA'ed in an online coursework ICS139W.",I have an experience of six plus year in C and C++ programming and have basic knowledge of JAVA and Python programming. I have had an experience of 10+ years of experience in Windows Operating Systems. I have been a TA for ICS139W course consecutively for the last academic year with considerable amount of understanding of the course content.,CourseTitleInstructorPositionWhenCS 297PCapstone DesignSergio Gago MasagueTA2019-fallICS 139WCritical WritingMustafa IbrahimTA2020-fallICS 139WCritical Writing Mustafa IbrahimTA2020-springICS 139WCritical WritingDarren DennenbergTA2021-fall,CourseTakenGradeICS 139WYICS 32NICS 6BNICS 6DN
39b4b7c5-417b-49b3-b1df-dfd9d937d9e9,"Parallel Computing Compilers Concurrent Programming Database Development Software Programming System Programming Computer Architecture and Operating Systems No experience in online courses, but have a vast experience in teaching assistantship in Physics and Technology School by Correspondence","Profound knowledge of C, C++ (have developed different projects, including bachelor thesis) Plenty of experience in Unix Small experience in Java (one project - chess game, with the use of AWT) Advanced user of Windows",CourseTitleInstructorPositionWhenCS 250ASystems ArchitectureAlexander VeidenbaumTA2023-winterICS 45CProgramming in C/C++Mustafa IbrahimTA2020-winterCS 143APrinciples of Operating SystemsLubomir BicTA2022-fallCS 131Parallel and Distributed ComputingAlexander VeidenbaumTA2023-spring,CourseTakenGradeICS 45CYACS 143AYAICS 33YAICS 3N
ef537e5f-3070-4571-8e99-1a83c84acb54,"What do you consider your area of expertise? In Computer Science, what are your special qualifications? (Please list as many as you can) For example. SWE 240P Data Structures SWE 241P Algorithms SWE 242P Network Programming  SWE 243P Database Programming SWE 244P Concurrent Programming SWE 246P Mobile Programming Do you have experience teaching online courses? Yes. I was a CS Tutor at UC Davis,  and I help CS Students at UC Davis and I hosted a review session online.","How much experience do you have with Java, VHDL, Scheme, C, C++, VHDL, and/or SQL languages? Advanced, except VHDL and Scheme. How much experience do you have with the Linux, Windows, and/or macOS operating systems? Advanced. Do you have other language, operating system, or database experience or knowledge worth noting? (Please Specify) Python. QuestDB, MariaDB, MongoDB, etc.",,CourseTakenGradeSWE 246PYA+SWE 242PYA+SWE 240PYASWE 241PYA
92052331-b19e-4035-bb53-55a1a8c074d3,"My primary area of expertise lies in sensor technology, underpinned by a multidisciplinary background in material science and electrical engineering. I have had the privilege of teaching an online course in material science (MSE 54) in 2021, where I was able to share my knowledge and passion for the subject with eager students. In addition to teaching, I have also served as a teaching assistant for BME 140. In this role, I had the opportunity to guide BME students in constructing ECG electronics, further solidifying my practical understanding of the field. On the computer science front, I have expanded my skill set through online learning. I completed a course on Coursera focused on Supervised Machine Learning, specifically Regression and Classification. This has equipped me with a solid foundation in these key areas of machine learning. Furthermore, I have also undertaken an online course to enhance my proficiency in Python. This has been instrumental in broadening my capabilities in programming and data analysis, complementing my existing expertise in sensor technology and material science.","With a strong proficiency in R, I have developed a knack for creating compelling data visualizations. My ability to transform complex datasets into clear and insightful graphics has been a key asset in my projects. I am adept at using R's various libraries and tools to create visualizations that effectively communicate data trends and insights. In addition to R, I have also honed my skills in Python, particularly in the realm of web development. I have experience in building interactive, user-friendly websites using Python. My understanding of Python's web frameworks allows me to create web applications that are not only functional but also engaging for the end-user. In essence, my strengths lie in data visualization and web development. I'm mainly using Windows operating systems.",CourseTitleInstructorPositionWhenENGR 54Principles of Materials Science andCharlette (Grigorian) McDevittTA2021-winterBME 140Design of Biomedical ElectronicsZhongping ChenTA2022-winter,CourseTakenGradeICS 31NICS 139WNICS 3NICS 32AN
b6e3b3f8-34d7-492a-8df7-a9490b748249,"I am writing to apply for the Teaching Assistant and Reader position at the University of California, Irvine. With my passion for education, strong communication skills, and previous experience in assisting students, I am confident in my ability to contribute to the academic community at the University of California, Irvine.  During my Bachelor’s, I gained a solid foundation in programming languages, algorithms, and software engineering principles. Through my coursework and projects, I have developed a strong proficiency in languages such as Java, C, C++, and Python. I like to spend my free time solving questions on Leetcode. This allows me to better my understanding of Data Structures and Algorithms and also sharpen my problem-solving skills.  Link : https://leetcode.com/KiranRaghavendra/  I consider my area of proficiency to be Data Science, Machine Learning, Deep Learning, and Image Processing. As an engineer, I aim to utilize technology to solve real-world problems. Keeping the same in mind I conducted my undergrad research on Breast Cancer Detection and Sign Language Recognition using Deep CNNs and Graph CNNs respectively.   As part of my study on Breast Cancer Detection, I trained the Resnet50 model from scratch on the Breakhis dataset and evaluated the effects of various image processing techniques on accuracy. Findings were presented as part of the 2022 Fourth International Conference on Emerging Research in Electronics, Computer Science and Technology (ICERECT) and published in the IEEE Explore Digital Library.  Link : https://ieeexplore.ieee.org/document/10059681  As part of the research conducted on Sign Language Recognition,  I proposed a novel technique to utilize facial key points in conjunction with skeleton key points for Sign language Recognition. This involved training the Sign Language Graph Convolutional Network(SLGCN) from scratch on the AUTSL dataset. This training included 24 key points to model facial expressions along with skeleton key points for the body. The findings have been published in the International Research Journal of Engineering and Technology (IRJET) Volume 9 Issue 7.     Link : https://www.irjet.net/archives/V9/i7/IRJET-V9I7142.pdf  To better my conceptual and practical understanding of Deep CNNs, Seq2Seq RNNs, and Siamese networks, I have developed various applications utilizing the same. As part of this activity, I trained InceptionResnetV1 from scratch for face recognition and evaluated its accuracy against the same neural network used as a Siamese Network by minimizing the triplet loss function. During my undergrad, I developed a chatbot using a custom-built Seq2Seq RNN, which was trained from scratch. This was integrated with the college website, thus enabling students to ask questions and resolve queries about the college.  The times I interacted with the students and guided them with my knowledge have been extremely joyous. I discovered my passion for teaching in my undergrad, particularly in my sophomore year when we had Data Structures. My friend was finding it a little tough to grasp the concepts of trees and graphs in data structures. At the time, I asked him to create numerous folders and subfolders to store a few files and asked this question. How should I traverse the folders to open a particular file? He answered my question, and I told him the method he explained is the depth-first search algorithm. At that moment, I realized that knowing the real-life use case of a concept before diving deep into a subject will greatly improve one's understanding of the subject.  Following this, I taught various concepts to fellow students and helped them understand it better. I connected different topics in computer science with real-life use cases and used analogies while teaching concepts. I explained how friends and followers are suggested on social networking sites using graphs and how undo operation is executed using stacks. One such fun session was when I cooked instant noodles and put it in a bowl to demonstrate Dining Philosophers Problem. This enhanced my friends' understanding of the subject and made me happy, and this is how I became passionate about teaching.   After discovering my love for teaching, I served as a Machine Learning Instructor at Google Developer Student Club at JSS Science and Technology University. During my time here, I conducted numerous tutorials, hands-on courses, and technical bootcamps and provided individualized support to students. Through this role, I learned how to create an inclusive learning environment for students, while catering to diverse learning styles. Additionally, I possess excellent interpersonal skills, which enable me to build strong relationships with students and staff. I strongly believe in creating a supportive and nurturing environment that encourages students to reach their full potential.  As a Firmware Engineer in the OptiNand team at Western Digital, I maintained complete ownership of multiple features of the Opti-Nand product line. My responsibilities included software design, development, and integration of various features. This experience enhanced my problem-solving skills and gave me practical exposure to Agile Methodologies and Software Engineering Principles. During my time here, I tutored multiple interns and helped them get ramped up quickly with feature and codebase knowledge. I often found myself answering questions and clearing doubts that interns asked me. This made me realize that teaching any concept, also allows me to acquire in-depth knowledge about the same.  I am excited about the opportunity to join the esteemed faculty at the University of California, Irvine, and contribute to the academic growth of the students. I am confident that my passion for education, and previous teaching experiences make me a suitable candidate for the Teaching Assistant and Reader position, which I sincerely hope to obtain.  Thank you for considering my application. I look forward to the possibility of contributing to the educational excellence at the University of California, Irvine.  Sincerely, Kiran Raghavendra","During my freshman year, I took the course Problem-Solving in C. C is the first programming language I learned and this introduced me to the fascinating world of programming. During my sophomore year, I enrolled in the course Object Oriented Programming using Java. This allowed me to obtain a solid foundation in Object Oriented programming and I was amazed by its vast applications in our day-to-day life. To better my practical understanding I developed a Bank Application, which works on the concept of Object Oriented Programming.   Additionally, I have also taken the course Database Systems in my junior year. This introduced me to DBMS, Relational DBMS, SQL, and NoSQL. To gain a practical understanding of the same, I created a SQL integrated web application for tourist data management. This comprised two modes. Admin mode which had elevated access to view, add, and modify information, and user mode to book travel plans on the website. The website was developed with a Flask backend and the database schema was normalized to 3rd Normal Form.  Following this, I have developed various deep-learning applications in Python utilizing the Pytorch and Tensorflow(Keras) frameworks. I also have a strong proficiency in various Python libraries such as Numpy, Scikit Learn, Matplotlib, Seaborn, and Pandas.   I have over 5 years of experience working with Windows and over 2 years of experience working with Linux distribution. I am adept at debugging common software/driver issues that arise on Windows and Linux operating systems.",,CourseTakenGradeCS 171YACS 161YACS 178NCS 122AYA
dafd5b30-6d72-46ea-8758-3c2ac1cf02a2,"Machine Learning, Natural Language Processing, Pattern Recognition, Data Mining, Deep Learning, Computer Graphics, Digital Image Processing, Database Management Systems, Computer Security, Web Programming, Artificial Intelligence, Data Structure, Algorithms, Structured Programming, Object Oriented Programming, Numerical Methods, Digital Logic Design, Operating Systems, Discrete Mathematics, Information System Design, Compiler Design, Computer Networks, Software Engineering, Applied Probability.","I have used Java, C/C++/C# for more than four years. I have created many projects using these languages, so I have a fair bit of experience in Java and C/C++/C#. However, I am more comfortable with python as I have been using python for last three years and built around 40 machine learning projects with it. I have experience in using Linux, Windows and macOS. Moreover, I have expertise in HTML, PHP and MySQL as I have developed web based projects and database projects.",,CourseTakenGradeCS 273AY4.0CS 178Y4.0ICS 31Y4.0ICS 45CY4.0
f787c848-6399-40c0-8140-74ca294dd3b4,"I would consider theoretical avenues my expertise. From basic discrete math to algorithms and cryptography.  In Computer Science, I have done theoretical research as well as practical research in a quantum computing lab. As an undergraduate, my lab and NASA collaborated on a Quantum Key Distribution project. I also did independent research into elliptic curve factorization and Galois theory. I have TAd for graduate as well as undergraduate classes. I also helped host practice exams for college calculus and physics classes. I have also helped various classmates as an undergraduate for upper level computer science classes.","Experience with C++. Some experience with VHDL and C. Exposure to Java, SQL. No knowledge of Scheme. Experience in Windows. Reasonable expertise in Linux/macOS.",CourseTitleInstructorPositionWhenICS 6DDiscrete Math for Computer ScienceJing ZhangTA2023-winterCS 167Applied CryptographyStanislaw JareckiReader2022-winterCS 161Design and Analysis of AlgorithmsMichael DillencourtReader2022-springCS 201PComputer SecurityMohammad Iftekhar HusainTA2022-fall,CourseTakenGradeICS 6DNICS 6BNICS 6NNCS 201N
85e59780-1ded-46a8-a57f-f1a9d493b9a0,"Area of Expertise- User Interface Design: Demonstrated experience in creating visually appealing and user-friendly interfaces using HTML, CSS, and related technologies.  Programming: Proficient in languages such as Java, C++, and Python, with a focus on writing clean and efficient code.  Software Engineering Principles: Solid grasp of software engineering principles and practices, ensuring code quality, scalability, and maintainability. Network Security: Knowledge of network security principles, including TLS, ensuring secure communication and data transmission.  Special Qualifications in Computer Science -  Master of Computer Science: Currently pursuing a Master of Computer Science degree from the University of California, Irvine, with coursework encompassing algorithms, data structures, machine learning, computer security, and text processing. Bachelor of Technology: I hold a Bachelor of Technology degree in Computer and Communication Engineering from Manipal Institute of Technology, with coursework covering data structures, object-oriented programming, analysis of algorithms, operating systems, and big data.  Publication: I have a publication on secure sharing of textual data using hybrid encryption algorithms, accepted at the International Conference on Electrical, Computer and Communication Technology (ICECCT'21).","1. My major coursework has been in C++ and Java. Java also being the language used during my previous internships. I have a good knowledge about SQL too. 2. I have a good amount experience with Linux and Windows. I have been using these OS for about 3-4 years 3. I have experience in JavaScript, React.js and other front-end frameworks.",,CourseTakenGradeCS 103YA+CS 122AYACS 132YACS 134YB
394b33d0-0f47-4dc7-b474-54244d3c0eb6,"I consider algorithm design, data structures, and machine learning to be my areas of expertise.  I have experience utilizing and implementing concepts from these topics in my work as a computer scientist for the US Navy.  Although I am an incoming Computer Science PhD student, I have experience teaching these topics at a University.   I have been a lecturer for the Computer Science Department at California State University Northridge (“CSUN”) for the last five years.   I have taught both undergraduate and graduate level courses at CSUN.  Some of the courses I have taught at CSUN are as follows: Computer Architecture and Assembly (Comp 122), Data Structures (Comp 182), Advance Data Structures (Comp 282), Machine Learning (Comp 442),  Expert Systems (Comp 560).  For these, I prepared class materials and lectures, assigned homework and projects, administered test, and assigned final grades.  I have also taught online-only versions of these classes during COVID lockdowns.","I taught my data structures and advance data structures classes in Java.  I also used Prolog to teach an expert systems class.    At work, I write programs in Python, C, and C++.  I use MATLAB to prototype and for proof of concept demonstrations.    I consider myself proficient in these languages.",CourseTitleInstructorPositionWhenCS 171AIntroduction to Artificial IntelligKaskTA2022-fallICS 6DDiscrete Math for Computer ScienceZhangTA2023-winterCS 171AIntroduction to Artificial IntelligKaskTA2023-spring,CourseTakenGradeCS 171ANICS 6BNICS 6DNCS 174N
