UUID,Area of Expertise,Programming,Past Experience,Course Prefs
b53b9571-3a34-4ad5-a9a7-e769a8914490,"I consider data structures, algorithms, and software engineering as my areas of expertise.  In my first year of undergraduate, I learned programming in C++, which introduced me to data structures. I also participated in student coding clubs where I learned how algorithms are used to solve coding problems. Curious about these topics, I took up CS electives like Data Structures, Algorithms, and Graph Theory. I also enrolled in MIT OCW courses like Algorithms and Design & Analysis of Algorithms to expand my knowledge. I became proficient in data structures and algorithms when I applied what I learned to solve practical programming questions. I solved problems on popular coding platforms like Codechef, Leetcode, and CSES. As the difficulty of the problems I solved increased, I also explored competitive programming. I started solving questions on Codeforces, a competitive coding platform where participants in coding contests solve 4-8 coding questions in a given time frame. After participating in many contests, I came across new problem-solving techniques like digit dynamic programming, dynamic programming on trees, and segment trees. By solving increasingly complex problems in less time, I increased my rating on Codeforces. I learned advanced algorithms and problem-solving techniques, which made me proficient in data structures and algorithms.  I am also proficient in software engineering. After learning C++ in my first year of undergraduate education, I also explored the web development domain. I enrolled in online courses to learn front-end and back-end development using technologies like Node.js, HTML, CSS, and jQuery. I made several personal projects to gain experience making modern, full-stack applications. I also learned mobile app development using UI frameworks like React Native. To apply this knowledge, I developed a personal task manager application called “What’s To Do?” and published it to the Play Store. I used Google Cloud Platform services for user authentication and data storage. When I joined JPMorgan Chase & Co. as a software engineer, I learned technologies commonly used in the industry like Java, Spring, and React. After learning these, I learned how software engineers develop enterprise software and write clean, modular code. I learned how project teams use an agile approach to develop software and follow the software development lifecycle. A combination of learning various modern technologies and professional experience as a software engineer in the industry made me proficient in software engineering.  I don’t have any experience teaching online courses in the academic domain. However, I have conducted online knowledge-transfer sessions for my team where I discussed technical topics like creating AWS Lambdas using Terraform.","I am adept in programming in C++, JavaScript, and Java.  I have been programming in C++ since 2018 (5 years experience). I learned C++ as part of my first-year undergrad curriculum. C++ is my primary programming language for solving technical problems. I have a strong foundation in data structures and algorithms and use it to implement solutions for programming problems in C++.  I learned Java (1yr experience) during my work experience at JPMorgan Chase & Co. I used it to develop full-stack applications using the Spring framework. After a year of experience developing spring boot applications, I am familiar with commonly used libraries like Hibernate, Jackson, Mockito, jUnit, Apache Commons, HttpClient, Redis, AWS SDK, and others.  I also learned basic SQL (1-year experience) during my work experience by writing queries to fetch data for business applications. I also worked on a Liquibase migration from Flyway where I learned about SQL and PL-SQL.  I have been using macOS for 3 years. Before macOS, I used Windows for 10 years and Linux for 2 years.  I am also proficient in building frontend UI components using JavaScript by leveraging frontend JavaScript frameworks like React.js. At JPMorgan Chase, I developed several UI screens and functionalities for business applications using React.js, Redux, and Redux-Saga. I also used JavaScript to write server-side logic using JavaScript runtimes like NodeJS for smaller-scale projects. I am also adept in building mobile applications using React Native, a UI JavaScript framework.  I also have exposure to Python by building machine learning models and performing data analysis on datasets during my undergraduate years.  I am also familiar with relational and non-relational databases. I have experience integrating and using MongoDB and MySQL as a database for applications.",,CourseTakenGradeICS 46Y9ICS 45CY8ICS 31NICS 45JN
d7c029f7-a3aa-49b4-be5c-6fbc60cad50e,Machine Learning/Reinforcement Learning/Deep Learning Probabilistic Graphical Models Convex Optimization Information theory/Probability theory Data Structures and Algorithms/Analysis of Algorithms Programming/Coding,"Programming Languages:   Python: Advanced   C/C++, Java, bash, MATLAB, R, JS, HTML, CSS: Intermediate   C#: Beginner  Database:   PostgresSQL, Clickhouse: Beginner  Operating Systems:   Linux, MacOS: Intermediate   Windows: Beginner  I'm comfortable with deep learning, machine learning, data science, and graph libraries in python. Also, I have experience in web development(Django/Flask), app development (Android), and Parallel programming (OpenMP).",CourseTitleInstructorPositionWhenCS 178Machine Learning and Data Mining Padhraic SmythTA2022-fallCS 274ALearning in Graphical ModelsPadhraic SmythTA2023-winterCS 178Machine Learning and Data Mining Gavin KerriganTA2023-springCS 274BGraphical ModelsErik SudderthReader2022-spring,CourseTakenGradeCS 274EYACS 273AYACS 178YACS 169YA
24a88098-e2ef-4574-804f-92b022c536a3,"I have three years of Software Engineering experience at Societe Generale (A French Investment bank) And Intel Corporation(Semiconductor Firm). At Intel Corporation, I had the opportunity to develop Intel-Trust Authority, also known as Project Amber. In this role, I utilized Intel hardware technologies to ensure the trustworthiness of computer resources on the cloud. I gained proficiency in coding microservice applications using Golang and gained experience in deploying applications using Kubernetes, Helm, and Istio. Additionally, I successfully led the migration of applications to a hybrid cloud infrastructure on AWS and Azure with a SLA of 99%. Prior to my tenure at Intel Corporation, I worked as a full-stack developer at Societe Generale Global Solution Center for a year and a half. During this time, I worked extensively with Python and Angular, contributing to the development of various projects specially in the field of networking. My area of expertise would be designing distributed systems on the cloud (AWS and Azure) and taking care of all security requirements and handling critical production issues. I do not have experience handling a course but I have managed two junior engineers in my team and helped them ramp up on the current architecture.","I am very passionate about data structures and algorithms for which C++ is my go to language. I have solved 700 plus problems on coding websites like leetcode and codeforces, thus strengthening my knowledge on dsa and C++. Apart from this I have build a campus link portal using Java swing, JDBC, Mysql and Mongodb. I also have professional experience in working with postgres and handling upgrades for the same. i have good knowledge on the linux operating system including Redhat and Ubuntu and worked on the same for 3 years to support Production.",,CourseTakenGradeCS 143AYSCS 134YBICS 32YSCS 151YA
a118cc4a-c231-43cf-8cd9-04b0ee278395,"I am currently pursuing Masters of Computer Science. Relevant Courses: Algorithms with Applications, Advanced Programming and Problem Solving, Introduction to Artificial Intelligence.  Relevant Courses from my Bachelors include: Advanced Data Structures and Analysis of Algorithms, Automata Theory, Operating Systems, Computer Networks, Cryptography and Network Security, Cloud Computing Services, Artificial Intelligence, Information Retrieval, Software Engineering with Project Management.  I have experience with a wide range of programming languages and technologies, including • Programming languages: Java, C, C++, Python • Web Development: HTML, CSS, PHP, AJAX, JavaScript, React.js, Django, Flask • Artificial Intelligence: NumPy, Pandas, Matplotlib, OpenCV, Scikit-learn, Keras, TensorFlow, MATLAB • App Development: Swift, SwiftUI • Databases: MySQL, Oracle, MongoDB, Firebase • Cloud Technologies: AWS, Azure I have also developed a number of web and mobile applications.  I also have experience teaching online courses.  • Appointed as a Senior Mentor of DJ Init.Ai, the AI club of DJSCE; taught core concepts of AI, wrote blogs, and mentored juniors on research projects.  I have published several research papers in this field:- Apple Leaves Diseases Detection Using Deep Convolutional Neural Networks and Transfer Learning Python, TensorFlow, Deep Learning, Computer Vision • Built a novel model for apple leaf disease detection to help farmers improve efficiency and reduce the costs of orchard management. • Performed data augmentation techniques and implemented an ensemble of DCNN models by leveraging transfer learning and fine-tuning for multilabel classification of apple leaves. • Authored and published a book chapter in Computer Vision and Machine Learning in Agriculture, Vol 2 in the Springer book series Algorithms for Intelligent Systems, DOI: 10.1007/978-981-16-9991-7_13.  Zero-shot approach for news and scholarly article classification Python, Machine Learning, Natural Language Processing • Suggested an approach to minimize computational costs and dependency on labeled data. • Employed a Zero-shot mechanism to classify BBC News articles and ArXiv scholarly articles into various unseen categories and compared it to the Multinomial Naïve Bayes model. • Authored and published a paper in IEEE International Conference on Advances in Computing,     Communication, and Control (ICAC3), 2021, pp. 1-5, DOI: 10.1109/ICAC353642.2021.9697327.  Sorting Algorithm using Radix tree and Binning Data Structures, Algorithms, Java • Proposed a new data sorting algorithm to sort numbers using radix tree and binning and observed that, the algorithm performed better than some ubiquitous algorithms on large datasets. • Published a chapter in Research Advances in Network Technologies, CRC Press ISBN: 9781032340487.  Visual Question Answering Python, TensorFlow, Deep Learning, Computer Vision, Natural Language Processing • Researched existing models, authored and published a paper titled ""Review of VQA: Datasets and Approaches in IEEE International Conference on Advances in Computing, Communication, and Control (ICAC3), 2021, pp. 1-6, DOI: 10.1109/ICAC353642.2021.9697283. • Constructed a multimodal system by integrating a pre-trained CNN and Bi-GRU.  Machine Learning Based Intrusion Detection System Python, Machine Learning • Programmed and compared various ML algorithms for anomaly-based intrusion detection. • Published a paper on the same in IEEE Fourth International Conference on Advances in Electronics, Computers and Communications (ICAECC), 2022, pp. 1-5, DOI: 10.1109/ICAECC54045.2022.9716648.","I have undergraduate and/or internship experience in Java, C, C++, VHDL, SQL and NoSQL Databases. I also have experience with Linux, Windows and macOS.",CourseTitleInstructorPositionWhenEECS 22Advanced C ProgrammingRainer DoemerReader2023-winterEECS 22LSoftware Engineering Project in CRainer DoemerReader2023-spring,CourseTakenGradeICS 31NICS 32NICS 45CNICS 33N
2b6a0681-f3e9-4103-be07-922b7048514e,"My areas of expertise are in Human Computer Interaction (HCI), Science, Technology and Society (STS), design, video game design and development, research methods, and object oriented computing.  Computer Science, I mostly focused on object oriented computing like in games and Arduino or electronics based projects. I also do research in critical thinking in computing.  I have TAed in the past during my masters, as well as here in my PhD for two GDIM classes. All have been in person.","Decent experience in C++ in Arduino and raspberry based projects. Have used Java in Processing. Most experience in windows, passing knowledge of Linux/ubuntu and macOS. Experience in C# via Unity.",CourseTitleInstructorPositionWhenGDIM 59Mixed RealitiesTess TanenbaumTA2023-springGDIM 129Games for ImpactKurt SquireTA2023-winterATLS 2200TEXT (Past University)Danny RankinTA2018-fall,CourseTakenGradeICS 166NICS 3NICS 60N
58ae2b90-0969-452c-acaa-ac6aca431423,"My core expertise lies in principles of programming, database management and java.","I have 2 years of work experience at the Union bank of Switzerland in java and SQL. Also I have worked on a project in my undergraduation on Spring, Java and postgresql.",,CourseTakenGradeICS 45JYA+MCS 122AYA+MCS 122BYA+MCS 220PYA+
18b53838-1c6b-4602-a660-fcc64a093863,"machine learning, artificial intelligence",not much OS experience,,CourseTakenGradeCS 284ANCS 184AYACS 175YACS 171YA+
a23dbd83-b255-4883-a0c3-4eda873cad66,"Areas I have experience with: Data Science, Exploratory Data Analysis, Data Visualization, Data Pipeline Building, Machine Learning Modelling, Explainable AI (XAI), Qualitative Research Methods for Health Informatics  I have experience working as a TA for an introductory Python course as part of the Google Ignite-CS Program's chapter on my college (undergraduate) campus.","I have some experience with SQL but barely any experience with other languages (Java, VHDL, Scheme, C, C++, VHDL) listed.  I have the most experience with Windows, a bit of experience with Linux and barely any experience with macOS.  I have the most experience with Python and STATA and a bit of experience with R and Tableau.",CourseTitleInstructorPositionWhenICS 139WCRITICAL WRITING ON INFO TECHDarren DenenbergTA2022-fallINF 163Project in the Social and OrganizatMatthew BietzTA2023-winterINF 174Health Data AnalyticsKai ZhengTA2023-spring,CourseTakenGradeICS 139WNINF 171N
95df5808-c681-45d1-b5c3-62681bad8306,"My expert area is Machine Learning, AI, and Natural Language Processing(NLP).  In addition, I have several experiences working with a conversational AI, recommender systems, data mining, and information retrieval systems.","I have been using ""Python"" as my main language and have several experiences with ""C"" language as well. I have used SQL as well. I am familiar with Linux, Windows, and macOS environments all.",CourseTitleInstructorPositionWhenICS 53Principle in System DesignIan HarrisTA2022-fallICS 295P Keystone project CS Ian HarrisTA2023-winterICS 297PCapstone Design Project Ian HarrisTA2023-spring,CourseTakenGradeCS 273AYA-CS 271YACS 178NICS 53N
126fdc66-3540-432e-9b6e-fc2714424fc5,"I have about a year of experience with teaching online, through being an assistant to TAs during my undergraduate studies, as well as running a club where teaching basic algorithms was a major component.  Generally speaking my expertise would lie in multithreaded programming, since that is the most professional experience I have had up to this point, as well as basic algorithms and data structures since that was the class that I had assisted in prior.",C/C++ - 3 years Cuda - 1 year Python - 3 years Java - 2 years Linux - 4 years Windows - 10 years,CourseTitleInstructorPositionWhenCS 161DES&ANALYS OF ALGORMichael DillencourtTA2021-fallICS 45CProgramming in C++ Raymond KlefstadTA2021-winterCS 260PFundamentals of Algorithms with AppMichael SchindlerTA2022-springICS 46Data Structure Implementation and ADaniel FrishbergTA2022-summer,
bc9da550-3ac8-4448-a957-4f3e6a469f32,"I consider software engineering my area of expertise since it was the specialization of my undergraduate degree and has been the focus of the internships I have done. This includes areas such as software analysis, design (e.g., architectural and design patterns), testing, documentation (UML), methodologies (e.g., Agile), version control, and working on larger software group projects. Besides this, I have experience with related areas such as distributed systems, algorithms and data structures, and databases.  My special qualifications in Computer Science include: having worked on larger projects in different programming languages (mainly Java, C#, Go, and web technologies), experience using my knowledge both in more theoretical reports and in an industry setting via internships (JP Morgan and Microsoft), and documenting systems in technical reports and presentations.  I do not have experience teaching online courses. However, I have been a TA at my undergraduate university for the in-person courses “Introductory Programming” (Java), “Distributed Systems” (Go), and “Study Lab” (extra sessions for first-year students in the courses: “Algorithms and Data Structures,” “First Year Project: Map of Denmark,” and “User Experience and Web Programming”). This included helping students with exercises and assignments, holding sessions on specific topics, and communicating with the course manager. The two first courses also included giving feedback on written and coding assignments.","I have significant experience with Java from university courses and internship experience. I have also been a TA at my undergraduate university for an “Introductory Programming” course taught in Java. I have experience with C from an operating systems class and SQL (focus on PostgreSQL) from a database class at my undergraduate university.  I have significant experience using macOS and Windows. I have used Linux when doing “Capture the Flag” challenges and for navigating a Kali Linux VM.  Other languages I have experience with include Go, C#, F# (functional programming), R, Python, and JavaScript. I also have experience with Git, Docker, and Kubernetes.",CourseTitleInstructorPositionWhenBSGRPRO1KUIntroductory ProgrammingClaus BrabrandTA2021-fallBSDISYS1KUDistributed SystemsMarco CarboneTA2022-fall-Study LabDan Witzner HansenTA2023-spring,CourseTakenGradeINF 43NICS 45JNINF 117NINF 121N
d748faaa-7c23-4ea8-86a2-7db383118f90,"I have experience with object oriented programming, web development, scientific computing, machine learning, data mining, and data science. In Computer Science my special qualifications are in recommendation systems, natural language processing, object oriented programming, software architecture and design, requirements analysis and specification, software engineering management ,new and emerging software engineering technologies and practices, and software metrics. I have experience with teaching online courses, as I work with a startup in India bringing live-based machine learning courses.","I have experience with Java. My experience with Java ranges from  undergraduate, graduate, personal projects, and industry experience. As an undergraduate I did very well in Comp 282 (Advanced Data Structures) which was based in Java. Additionally, I did well in Comp 586(Object Oriented Programming).  I do not have experience with VDHL, Scheme, C, or C++.  I have experience with Unix and the Windows Operating System from using it as an undergraduate, graduate, with my personal projects, and in industry. I took Comp 322(Introduction to Operating Systems and System Architecture and Lab) as an undergraduate which was based on using Unix and using the Windows Operating System. I did well in this class as well.",CourseTitleInstructorPositionWhenINF 141Information Retrieval Alberto  Krone-MartinsTA2020-fallINF 141Information Retrieval Alberto  Krone-MartinsTA2021-winterSWE 272PProject Mangement Emily Navarro TA2021-fall,CourseTakenGradeSWE 272PNSWE 276PNSWE 240PNINF 141N
f52e7caa-6eaf-4350-9870-cd89acc9ce97,"Having completed my undergraduate studies in Computer Science, I possess a strong grasp of fundamental CS subjects. My expertise lies in Python programming, Advanced Algorithms, and Database Management Systems, which I have been actively working at Oracle for the past two years since my graduation. I have excelled academically, achieving grades of A and above in all the aforementioned courses during my undergraduate program.  Furthermore, I have actively contributed to the academic community by conducting numerous seminars on Python programming for my juniors as part of IEEE activities. Additionally, I have actively participated in various workshops organised by my undergraduate institution.  Besides my professional and academic accomplishments, my primary area of interest centers around Machine Learning & Artificial Intelligence. I have honed my skills in this domain by enrolling in online courses and successfully completing a Deep Learning model for my final year project.","In my undergraduate studies, I have acquired strong expertise in both C and C++, earning grades of A and above in the C course and C++ Lab. Additionally, I have been consistently utilising my SQL skills at my current position in Oracle, where I write queries to address various business requirements. Notably, I also attained an A grade in my undergraduate DBMS course, further reinforcing my proficiency in this area. Windows: Advanced Proficiency (Used throughout my undergraduate course) MacOS: Advanced Proficiency (Used in my professional experience) Linux: Intermediate Proficiency",,CourseTakenGradeICS 32AYAICS 45CYACS 122AYACS 171Y
15aa0e78-4696-4c30-8cca-d278450c775e,"Programming Languages for Java, Python Programming for Algorithms, Software Engineering, VR/AR game development using unity, Machine Learning, Artificial Intelligence, Database Systems, Operating Systems, Parallel Programming, Embedded Systems, Computer Networks, Linear Algebra, Calculus, Data Structures, Computer Architecture, Block Chain.  I'm well versed with software engineering concepts working in CISCO, two startups. At CISCO we saw the impact of release at large scale and what pre processes needed to make software robust.  Also release life cycles essentially reflect the health of software. But the setup is different in startups. Given my background & experience, I'm looking forward to your response.   Human computer interface is something I have first encountered in undergraduate where professor asked us to develop an AI agent that played game with Arthritis affected children mainly but can be used by anyone. I have attended couple of webinars on HCI as well.  I have a work experience of 5 years in building Secure systems using Golang, NodeJS,C++ & C language. Mainly focused on buffer overflows, active & passive attacks, PGP kind of authentication protocols, learnt a thing or two about Secure Boot & Secure storage. Along with that I have done below course in my undergraduate in IIT Delhi.    While working, I continued my studies. I engaged in Deep Reinforcement Learning at IISc Bangalore, scoring 8 given the need to manage the demands of my job. We have used TD learning to predict blockchain prices.    I have worked as Lead Engineer for a startup & was involved in the different phases of fund raising, hiring right person & putting in processes to achieve it, working for a stable state to go public.   So working in 2 startup’s , one in Block chain & other a text extraction product startup I have a holistic view on product development in terms of micro service architecture.","I have a expert level experience in C++, Python. I have used SQL, Java in my work to build a subsystem of Deep Learning OCR system which churns huge amount image data uploaded into a web app. I also couple of projects building games using OpenGL, android studios. Hence, it gives a better student perspective while teaching or discussions or evaluation.   When working in software industry, I have become proficient in Line commands & automation of build, test pipeline, deployment environment. Apart from this, I have knowledge of various programming tools like VSCode, Eclipse, makefiles, Docker, Kubernetes  etc.   I have knowledge of frame works like ReactJs, Django, SpringBoot, Express JS, Node Js etc. Also I've built application on top of databases like MongoDb, PostGresSql, Redis and have deep understanding of micro services architecture and their pipelining.    Java : 5years, Python : 8 years, C++ : 8 years,  SQL : 5 years.  C : 8 years. VHDL : 1 year. HTML  CSS Javascript  NodeJs : 2 years ReactJs : 2 years  I have experience of using CentOS, Ubuntu, Windows, MacOS. I have experience of using MongoDB, PostGresSql",CourseTitleInstructorPositionWhenCS 178/CS 256Machine LearningSantanu MahapatraReader2019-fallINF 113Reqt Analysis/ EngineeringEmily NavarroReader2022-winterINF 113Reqt Analysis/EngineeringEmily NavarroTA2023-spring,CourseTakenGradeCS 132Y9CS 178Y8CS 271Y6CS 143AY8
