UUID,Area of Expertise,Programming,Past Experience,Course Prefs
47e3603e-fa77-4ae2-81c2-ac1f83a19bff,"I am a second-year software engineering Ph.D. student. Software Engineering is my expertise. I have 3 quarters TA experience for IN4MATX 43(Introduction to software engineering), INF115 (Software Testing), and SWE261P.","I have teaching experience in JAVA language in Summer Session 1 2023, and then course and project experience in C++, and SQL languages.  I have moderate experience in both windows and linux operating system.",CourseTitleInstructorPositionWhenSWE 261P Software Testing and DebuggingJim JonesTA2023-winterINF 115SW TEST&QUAL ASSURJim JonesTA2023-springINF 115SW TEST&QUAL ASSURJim JonesReader2022-springINF 43Introduction to software engineerinJim JonesTA2022-fall,CourseTakenGradeINF 43YAICS 46YA-ICS 31YA-
47e27769-aaaf-4349-bf93-1ac0917926d1,"(1)Expertise Area: Machine Learning, Artificial Intelligence, Data Science (2)Special Qualifications: Machine Learning, Artificial Intelligence, Data Science (3)TA experience: I want to get more TA experience","(1)programming language: a little bit C++,  (2)OS: familiar with Windows (3)Proficient in: Python, Matlab,",,CourseTakenGradeCS 271YACS 171NCS 178NCS 273AN
fd785cea-fbe1-4fed-872b-c5e9ffa21fac,Computer Science BA Former TA for neural networks class at Harvey Mudd College Former TA for Informatics 131 HCI Current TA for ICS 31,"Experienced: SQL, Python Some experience: JS, Java, C, C++ No Experience: VHDL, Scheme I have experience with all 3 operating systems",CourseTitleInstructorPositionWhenINF HCIDr. Stacy BranhamTA2022-fallICS 32Intro to programmingDr. Alberto MartinsTA2023-winterINF HCIDr. Stacy BranhamTA2023-spring,CourseTakenGradeINF 151N
91599e39-5d3b-42e3-968c-1519da427bf5,"I was in UCI for undergrad. I was a Discussion Leader during this time. I led a class for Uni Stu 1 just like Teaching Assistants do. When it comes to teaching, I am very passionate about it. I was also a course reader for Econ 115. In computer science, I took ICS 3 during my last quarter as an undergrad here. I am very knowledgable about technology. The classes that fit me would be ICS 3, In4Matx 43, ICS 5, etc.",I do not have experience with coding. I understand the Windows and MacOS operating system and are able to use them well.,CourseTitleInstructorPositionWhenECON 115Behavioral EconomicsGeorge SarrafReader23-spring,CourseTakenGradeICS 3YAINF 43NICS 5N
328d083b-46d0-4738-a132-2db7692dd6ce,,"Fluent in using Linux, Windows and macOS operating systems. Fluent in using Fortran, Python, R and MATLAB.",CourseTitleInstructorPositionWhenSTAT 7Basic StatisticsLee KuceraReader2023-spring,
e4361764-324c-410a-9a7d-aa4081906ebe,"Good at database, data structure, algorithm","Good at Java, C/C++. Familiar with Linux, Good at Windows, no experience of macOS.",CourseTitleInstructorPositionWhenCS 134Computer and Network SecurityQi Alfred ChenReader2021-fallICS 45CProgramming in C++ as a Second LangKLEFSTADTA2022-winterCS 122BProjects in Databases and Web AppliKLEFSTADTA2022-spring,CourseTakenGradeICS 45CNCS 122BN
64785ab8-4054-4851-a535-9d268938577c,"In Informatics, I work with qualitative research methods in the field of accessibility and assistive technology. I have a lot of experience with research paper writing and research presentation.  In Computer Science, I have worked with C/C++/C#, Python, Matlab, and Unity/Unreal. I have some experience with Maya, working with motion capture data and machine learning on that data, and modeling humans in Maya. I have experience with Unity and building AR applications. I worked in the VR Worlds workshop on building course material as well as teaching the workshop. I am now working in C# with Unity, ARFoundation and ARCore, and OpenCV for my research project. I also learned about (convolutional) neural networks and deep learning using tensorflow  and pytorch for computer vision in Summer 2021/2022 during internships.  Experience teaching: ICS 141 Fall 2018 and Winter 2019, ICS 143a Spring 2019, ICS 143b Fall 2019 and Winter 2020, ICS 46 Spring 2022 Online courses: ICS 111 Spring 2020 and Fall 2021, CS 141 Fall 2020, CS 112 Winter 2021, CS 118 Spring 2021, CS 116 Winter 2022","I have a lot of experience with C/C++ since most of the code I wrote in undergrad was in C or C++. I mostly code in Unix, so I have a lot of experience in that environment. I learned some Java and scheme in programming languages class for one quarter. I have experience coding in Windows in Visual Studio, and I have very little experience in VHDL or SQL.  I also have a lot of experience with Python, especially with numpy and matrix manipulation, sklearn, and matplotlib. I also have a lot of experience with C#.",CourseTitleInstructorPositionWhenCS 116Computational Photography & VisionCharless Fowlkes TA2022-winterCS 141Programming LanguagesRay KlefstadTA2023-winterCS 111Digital Image ProcessingAditi MajumderTA2021-fallICS 33Intermediate ProgrammingAlex ThorntonTA2023-spring,CourseTakenGradeINF 131NCS 141YACS 143AYAICS 33N
380b47cd-4f04-4447-8c7e-f8c6400d1e75,"My area of expertise is in leveraging big data for public health causes. My research experience leverages online technologies (social media data) to predict human behaviors and outcomes, along with understanding public perceptions and health misinformation. I have experience collecting, analyzing, and visualizing big data to improve the timeliness of health data. I have experience using Natural Language Processing tools (Supervised Machine Learning methods such as Naive Bayes using Python), on big data related to SARS-coV-2, opioids, and HIV/AIDS. I have also held a position at UCI Health's Department of Emergency Medicine conducting big data related work.",I have experience using Python for supervised machine learning methods in order to predict sentiment or classify data into categories. Very experienced in macOS operating systems and design systems such as Sketch and Adobe products (LightRoom).,CourseTitleInstructorPositionWhenINF 171Health InformaticsYunan ChenTA2022-fall,CourseTakenGradeINF NICS 80NINF YICS 31YB
da77afbd-45f1-4a87-ae19-e3961ea34edc,"I have TAd 4 times @ UC Davis 3 intro to computer science courses - i loved them so much and the students really enjoyed my office hours  1 architecture class lots of experience in security, oop, c/cpp/java/python, etc.","Work professionally in java couple of internships in cpp plenty of experience in linux,windows, and macos some functional programming as well",,
06b766ff-23fa-461e-b18b-67d07357acf3,"With a focus on Data Science, my area of expertise encompasses various fields such as Data Analysis, Data Mining, Machine Learning, Natural Language Processing, AI, and statistical analysis. Throughout my academic journey, I have excelled in these subjects, earning a Bachelor's degree in Data Science with Magna Cum Laude honors at William & Mary and pursuing Master of Data Science at UCI. Proficient in essential programming languages like Python (Pandas, NumPy, TensorFlow, Scikit-learn, LightGBM, NLTK, etc.), SQL, R, Tableau, and HTML, I have hands-on experience utilizing these tools to solve real-world problems including two internship experiences as a data scientist and R&D algorithm engineer.  I also have experience in mentoring freshman student-athletes online, and my role as an MDS Program Ambassador has allowed me to engage with prospective students and share my knowledge. Furthermore, my background as a student-athlete on a Division I varsity tennis team has honed my teamwork and leadership skills, making me adept at supporting and guiding students in an educational setting.","My primary programming experience lies in Python, SQL, and R, where I have undertaken numerous data science projects, applying sophisticated libraries such as Pandas, NumPy, TensorFlow, OpenCV, Matplotlib, NLTK, Scikit-learn, NetworkX, Pyvis, and LightGBM. Through the internship experience as a data scientist inern, I enhanced my strengths in data science projects by developing Python code, which performed skeleton detection utilizing AI pose estimation on 204 processed picture data to locate framework into 2- and 3-dimensional coordinates. Additionally, I implemented a statistical analysis and visualized results of distribution in histograms for the project goal.  Additionally, my data science background has exposed me to various database management systems, and I am very confident in database creation and management for data storage, retrieval, and manipulation as I have created a sales database and e-commerce database using SQL from scratch. In terms of operating systems, I am well-versed in Windows and macOS, having utilized them extensively for academic and data science purposes.   In summary, my expertise lies in Python, SQL, and R, and I possess the adaptability and determination to tackle other programming languages and operating systems efficiently. With a passion for data science and a commitment to sharing knowledge, I am well-prepared to excel as a TA, supporting students in their learning journey and contributing to the success of the program.",,CourseTakenGradeCS 122ANCS 132NCS 171NCS 178N
ba1975f5-0688-4f34-b0ce-b74dcab9bb13,"In computer science, apart from working on various projects which involved full stack development, android programming and machine learning concepts. My special qualifications are in software engineering. I was placed as 2nd runner up in a national level hackathon  to design a verifier application using flutter and firebase to verify the local residents completely offline using FaceAuth, OTP and eKYC APIs. In my undergraduate, I have taught more than 100 underprivileged students about basic of computer and it’s application through RAIT-ACM(student chapter of ACM organisation).","In my undergraduation, I have taken up courses like C programming, OOP with JAVA, python programming, cloud computing in which I have an outstanding (O) grade. I have worked on projects where I had to build an intranet based system using SQL and PHP. I have worked on windows, Linux and macOS operating systems for the last 4 years.",,CourseTakenGradeICS 45CN0.0ICS 46N0.0INF 24N0.0CS 122AN0.0
330c54e5-d258-4f96-b96e-b648eb0c0b41,"I am strong with programming languages like Python, Golang, MATLAB, Java, C/C++. I am also proficient in project planning and critical writing in the IT domain. Cloud Networking and Software development are the fields in which I have worked on extensively in a professional environment and hence I am comfortable with any of their subdomains. In addition, I have 3 years of professional experience at HPE, during which I have worked on various tech stacks . I have experience teaching in a professional environment as I have mentored many junior engineers at HPE.  Also, I have experience teaching programming and personality development classes virtually during the pandemic.","I have programmed in C, C++, Java, Python and Golang when I worked as a Software Designer. I have about 5 years of experience with building software, testing and debugging with these languages. I have written more than 500,000 lines of code in Python and Golang and about 300,000 lines of code with Java and C/C++. I have worked on various SQL languages and am experienced with NoSQL, PostgreSQL and Cassandra SQL languages for more than 5 years. I have worked on Linux, Windows and macOS systems for more than 5 years. I have about 2 years of experience VHDL and Verilog, having used them for my undergraduate research projects. I am also proficient in engines like Unity and container software like Docker and Kubernetes.",CourseTitleInstructorPositionWhenINF 141Information RetrievalAlberto Krone MartinsTA2023-spring,CourseTakenGradeINF 141YACS 143AYAICS 139WYAICS 33YA
3bd88098-f527-487a-911b-ad2cee5e04d7,"My area of expertise is in the following areas - Programming & Data Structures, Artificial Intelligence & Machine Learning, Data Science, Information Retrieval, Web Application Development. I'm passionate about the usage of Computer Science to uplift and contribute to the betterment of humanity.  Personal Webpage - https://abhinandg.github.io/AbhinandG/ Github - https://github.com/AbhinandG/   Programming Skills:  • I hold a Microsoft Training Associate (MTA) certification in ""Python Programming"".   • I have certifications in the following disciplines - ""Machine Learning with Python"" and ""Data Analysis with Python"", where the latter was offered by IBM • I've completed a novel project on ""Web Phishing Detection"", powered by the IBM Developer Skills Network. • During the sophomore year of my undergrad, I developed a Discord Bot called ""Kanmani"". Kanmani is now being used in over 100 servers over Discord and has also been recognized as a ""Verified Bot"" by Discord (among the few bots to receive this status).  Research Work: • I presented a paper titled ""Application of Phonocardiogram and Electrocardiogram Signal Features in Cardiovascular Abnormality Recognition"" at the IFIP 7th International Conference on Computer, Communication and Signal Processing (ICCCSP - 2023). The proceeding is scheduled to be published in the ""Springer IFIP AICT Series"" Book Series next month. [Special Note: My paper was shortlisted among the presented papers to be eligible for an extended version, that is to be published in the Journal - SN Computer Science] • I presented a paper titled ""A Novel Geofence-Oriented Approach to Activity Alerts and Notifications for Dementia Patients"" at the International Conference on Advanced Communications and Machine Intelligence 2022. The proceeding is scheduled to be published as a part of the Springer Book Series - ""Studies in Autonomic, Data-driven and Industrial Computing"" next month. • I presented a paper titled ""An Efficient Stacking Ensemble Technique for Success Prediction of Indian Ventures"" at the 2022 International Conference on Data Science, Agents and Artificial Intelligence (ICDSAAI). It is published by IEEE. [DOI: https://doi.org/10.1109/ICDSAAI55433.2022.10028895]  English Proficiency: • My English proficiency is exemplified by a perfect 30/30 score in the Speaking and Reading sections of the TOEFL test, resulting in an overall score of 116/120. This achievement underscores my excellent command over the language, thereby enabling me to be an effective Teaching Assistant (TA).","Skill set - Python, Java, C, C++, SQL, PHP, JavaScript, JCL, SELCOPY, API Development, MATLAB.  Programming - • I have over 5 years of experience working with Java, C, C++, SQL, PHP, JavaScript and Python. • I am also familiar with Java frameworks like Java Server Faces (JSFs) and have experience instantiating and using web servers such as Apache Tomcat, WildFly (JBoss), etc. • I have experience in working with JCL (Job Control Language) and SELCOPY - which I worked on during the course of my internship at Citigroup as a Technology Summer Analyst.  • I have done a number of personal projects, a lot of them which involved the usage of various database systems like MySQL, PostgreSQL and SQLite for android applications. I've developed private APIs that use SQL to receive and provide responses to queries that require access to the database.  Software, Frameworks, and Operating Systems - • I also have experience working with software like MATLAB and Weka. I have also used various frameworks like Flask and PyTorch for my projects. I have significant experience working with Linux (Ubuntu), Windows and macOS for more than 5 years.",,CourseTakenGradeICS 32AYA+ICS 45JYA+CS 171YOICS 31YA+
c6944d6e-a91e-48ea-a6e2-e6b042a178db,"Most of the courses I plan to TA  are part of my Undergrad curriculum and have a high intersection with theoretical Computer Science, maths, and Logic. I am doing my Ph.D. in Theoretical Computer Science - Algorithms and I have a good amount of exposure and experience doing research in these fields (3 years as a student and research assistant). I was a reader for the CS161 course twice before. Some of the courses(CS260P, ICS31, ICS45C, etc. ) I listed require C++ programming skills and I have 7 years of experience in coding in C++. I have secured grades in the A-B range in most of these courses and have also done respective advanced courses in my Undergrad.",I have 7+ years of coding in C++ and 2 years of experience in Java. I am comfortably fluent in Python(have done 4-5 projects) too. I have been using the Linux platform for coding for 7 years and am currently using Windows for the last 3 years. I am quite equipped in solving tasks on both these platforms. I have 2 years of experience in SQL(1+ year in my undergrad and 8 months work experience).,CourseTitleInstructorPositionWhenCS 161Design and Analysis of AlgorithmsMichael DillencourtReader2020-fallCS 161Design and Analysis of AlgorithmsMichael DillencourtReader2020-winterICS 31Intro to programmingShannon AlfaroTA2022-fallCS 263Analysis of AlgorithmsVijay VaziraniReader2021-winter,CourseTakenGradeCS 260PYA+CS 253PYB+CS 266/164YAICS 45CYB
1ac760bd-011e-4c2b-b3b6-19061286d0b4,"My area of expertise is Web applications development incorporated with machine learning models. I love solving scale, data quality, and compliance challenges for Geo-distributed, concurrent data pipeline platforms.  Throughout my undergrad, I took various courses like Information security, Computer networks, Digital Logic Design, Embedded systems, etc, which helped me to build a good grasp of the core fundamentals of computer science. Apart from these, I have also completed a couple of online certification courses such as Intro to Machine Learning, Basics of Deep Learning, Intro to the Internet of Things, etc. These helped in my final year project as I along with my project-mates built a GAN-based model to segment human retinal vessels and detect diabetic patients through their retinal images. My research paper (https://ieeexplore.ieee.org/document/9515093) was also accepted at an international conference held in Romania.  I have experience with teaching online courses,  during my undergrad, I was involved with an NGO wherein, I used to teach basic concepts of python programming language to underprivileged kids. Also, I was associated with my college student chapter (Association for Computing and Machinery) at NIT Surat, wherein, we used to organize seminars and special talks on various topics related to the field of computer science.","I have good expertise in Java, C, C++, and python. Most of my competitive programming experience has been in Java and C++. I have also passed the LinkedIn skill assessment examination for C++. Last fall, I completed an online certification course related to SQL language. VHDL and Verilog were taught to me in the Digital Logic Design course during undergrad. I also did some mini-projects related to circuit designing using VHDL and Verilog. Hence, I am skilled in these languages.  Most of my experience has been with Windows and the Linux Platform. I am well-versed with all Linux commands as over the past year I was working as a systems engineer at Jio Platforms Ltd, where most of my work was centered around deploying and automating tasks in the shell and the environment. Apart from this, I have knowledge of various tools such as Cisco Packet Tracer, VS Code, and frameworks like ReactJS, ExpressJS, NodeJS, and databases like Google firestore and MongoDB, etc, and have accomplished various projects related to full stack development.",CourseTitleInstructorPositionWhenINF 133User Software InteractionMark BakdwinReader2023-winterINF 121Software Design IVan Der HoekReader2023-spring,CourseTakenGradeINF 141YAINF 121YAINF 43YAINF 133YA
ae912dd8-7c8b-4605-9aa4-2d2e6aac30d3,"I do not have an area of expertise, but I am most familiar with Python, R, probability, and data science. I do some experience leading discussions sessions via Zoom, and have taken many online courses and can understand both the benefits and difficulties of online teaching.","I have around half a year of experience with C++ (took ICS 45C and ICS 46).  In terms of SQL, I have around 1.5 years of experience through classes, research, and part-time jobs. I am familiar with MySQL, Microsoft SQL Server, and Spark SQL.  I have around 4 years of experience working with the macOS operating systems, and know the basics of Linux and Windows. I have a basic understanding of Matlab. I am also very familiar with Python and working with its different IDEs, such as IDLE, PyCharm, and Jupyter Notebook.",CourseTitleInstructorPositionWhenSTAT 67INTRO PROB&STAT/CSKoko GulesserianTA2022-fallSTAT 111STATS METH DATA IIKoko GulesserianTA2023-winterSTAT 7BASIC STATISTICSLee KuceraTA2023-spring,CourseTakenGradeSTAT 110YASTAT 67NSTAT 120AYASTAT 6N
8ad6ab32-1917-4bd7-880b-41a60445a1a8,Statistics and its application.  I have been the instructor for the following: 1. Intro to Stats (USU STAT 1040) 2. Trigonometry (USU MATH 1060) 3. COLLEGE PREP (USU MATH 0995),I primarily use R (4+ years) a macOS.,,CourseTakenGradeSTAT 6NSTAT 8NSTAT 7NSTAT 67N
660fbb8b-1f67-4f5c-a967-158b3501d846,"I consider Games Studies, Public Administration, and Higher Education my areas of expertise.  I have certificates in Community College teaching, course design, and mentoring.  I have undergraduate knowledge of K-12 education and political science.  I have completed nearly all pedagogical co-curricular activities through DTEI, short of becoming a pedagogical fellow.  I have taught at UCI and USC as an instructor of record, taught summer sessions of undergrads and high school students, and have TA'd several quarters, including online courses.",None,CourseTitleInstructorPositionWhenICS 139WCRITICAL WRITING Morten Bay ChristensenTA2019-summerICS 60GAMES AND SOCIETYConstance SteinkeuhlerTA2019-fallINF 131COMPUTER HUMAN INTERACTIONStacy BranhamTA2020-winterICS 60GAMES AND SOCIETYConstance SteinkeuhlerTA2020-spring,CourseTakenGradeICS 60NN/AGDIM 25/ ICS 61NN/AINF 151 NN/AICS 3 OR 4NN/A
9c145c59-88fa-4961-b814-9203039e9044,"I am a software engineer with 7 years of industry experience. I have been a Mentor to junior software developers for 4 years (2019 - 2022) in my last job. As a mentor my responsibilities were to: 1. Help the new hires in understanding their coding assignments 2. Guide them with programming languages (C#) and SQL 3. Teach SOLID design principles, design patterns, best practices along the way 4. Evaluate their work on assignments 5. Provide written feedback  From April 2020 to April 2022, I did all of this online over Teams meetings. Besides teaching, I am good at time and task management.","Experience: 1. C#, SQL, Windows OS, WPF: 7 years of industry experience 2. C++, C: 4 years of academic experience 3. Python, Linux OS: 2 years of academic experience 4. Java: 1 year of academic experience 5. Compilers: 4 months of academic experience",,CourseTakenGradeCS 141YCS 143AYCS 122YCS 122BY
dd4e5d61-55ab-4a24-b38d-ff681b8f291d,"- I consider my area of expertise in health informatics and computational biology, since I completed my undergraduate degree in Biomedical Engineering, and undertook 2 internships that focuses on the 2 areas respectively. I also have experience on robotics, since I was part of a student interest group where we made a robotic fish (which holds the Guinness World Record for the fastest 50m swim). Moreover, I worked with computer vision throughout my Final Year Project in undergraduate, which was about super-resolution using deep learning approaches.  - I have taught ENGG1330 (Introduction to Programming), offered by The University of Hong Kong. At the time, this course was offered online, and I was one of the student TAs for the course. As a TA, I held weekly tutorials to a class of 30-40 students, helping them with basic programming concepts, tutorial questions, and assignments.","- I have taken courses on Java, C++ and SQL in HKU. - I have experience working with Linux, Windows, and macOS operating systems, but among the 3,  I am most comfortable with macOS. - I am most experienced in Python, since most of the programming tasks (during internships) used Python. I also have considerable experience with Arduino, since I had 2 projects that required extensive use of Arduino. The first project required me to add wireless movement control to the robotic fish, and the second project was to build a pulse oximeter from scratch, using Arduino. - I have taken CS courses on Object-Oriented Programming (OOP), Computer Organisation, Cyber Security, Database Management, Data Structures and Algorithm, Computer Networks.",CourseTitleInstructorPositionWhenICS 31Introduction to ProgrammingAt a different university(HKU)TA2020-fall,CourseTakenGradeICS 31YAICS 51YACS 122AYA+CS 134YA+
7aeb89ec-20d5-4321-b498-18e55167997b,Web Full stack development. I do not have any special qualifications and experience teaching online courses.,"Java 2 yrs, SQL 1.5 yrs. Windows over 10 yrs, MacOS about 1 yr. C# 2 yrs, Python about 1 yrs. SQL experiences: Supabase, PostgreSQL, MySQL",,CourseTakenGradeSWE 240PYASWE 250PYASWE 243PYASWE 242PYA
